{
  "baseline_manifest_digest": "sha256:3333333333333333333333333333333333333333333333333333333333333333",
  "clean_audit_report_digest": "sha256:1111111111111111111111111111111111111111111111111111111111111111",
  "owner_attestation_digest": "sha256:2222222222222222222222222222222222222222222222222222222222222222",
  "run_id": "run-1",
  "schema": "approved-bundle-v1",
  "staged_manifest_digest": "sha256:0000000000000000000000000000000000000000000000000000000000000000",
  "targets": [
    {
      "digest": "sha256:4444444444444444444444444444444444444444444444444444444444444444",
      "mode": 420,
      "path": "README.md"
    }
  ]
}
